N°;type-id;thematic-id;Titre;author-id;editor-id;Mentions d'édition;Date de publication;Pagination;Tomaison;collection-id;language-id;ISSN - ISBN;Support;Adresse Document Source;Lien URL;localisation-id;Cote;Résumé;Statut;
664;22;13;23 ème rapport sur l'état du mal-logement en France |  2018;178;165;Non;01/01/18;383 p.;Non;111;5;Non;Physique & en ligne;Non;http://www.fondation-abbe-pierre.fr/nos-actions/comprendre-et-interpeller/23e-rapport-sur-letat-du-mal-logement-en-france-2018;1;HAB 00044;La 23e édition du rapport annuel sur L’État du mal-logement de la Fondation Abbé Pierre livre une nouvelle description de la crise du logement. Si le marché de l’immobilier affiche une bonne santé générale - 4 millions de personnes restent mal logées ou privées de domicile - tandis que 12 millions voient leur situation fragilisée par la crise du logement. Au total - près de 15 millions de personnes sont touchées - à un titre ou à un autre - par la crise du logement. Au-delà de cette dure photographie - la dynamique ne prête pas à l’optimisme. La qualité moyenne des logements continue de s’améliorer - mais la hausse des prix creuse les inégalités résidentielles et bouche l’horizon des ménages des couches populaires. Comme si des centaines de milliers de personnes - en plus d’être mal-logées aujourd’hui - se voyaient assignées à le rester toute leur vie. Ce rapport met l’accent sur une des formes de mal-logement les plus difficiles à vivre : le surpeuplement. En déclin sensible pendant des décennies - le surpeuplement connaît une recrudescence inquiétante au cours des dernières années.;Non disponible;
663;21;3;40 ans de politique de la ville;259;117;Non;01/11/17;55 p.;Non;111;5;1240-0874;Physique;Non;Non;1;AMU 00187;Le Commissariat général à l’égalité des territoires (CGET) est le partenaire de ce numéro hors-série de la revue Urbanisme publié dans le cadre de la démarche « Les 40 ans de la politique de la ville - inventons les territoires de demain ». Une série d’événements - locaux et nationaux - organisés ou labellisés par le CGET vont se dérouler dans les prochains mois. Ce numéro hors-série contribuera à les accompagner. En supplément de ce numéro - un poster sur la chronologie de l'histoire de la politique de la ville.;Disponible;
662;21;19;Planification et tourisme : 1er partie - le cadre de référence;165;173;Non;01/03/18;111 p.;Non;111;5;0336-1446;Physique;Non;Non;1;TOU 00004;Les lois SRU - Alur - ENE et Notre ont sensiblement fait évoluer le cadre global de la planification territoriale. Sur le littoral - en montagne ou en espace rural - l'intercommunalité est désormais - de plus en plus souvent - l’échelle pertinente pour coordonner les politiques d’urbanisme - de déplacements et… de tourisme. Le Scot (schéma de cohérence territoriale) est l’outil de conception et de mise en œuvre de cette planification intercommunale. Document stratégique autour duquel s’articulent les stratégies régionales et les plans locaux d’urbanisme - le Scot peut contribuer à organiser - réguler et orienter l’offre touristique à grande échelle. D’une façon générale - les Scot intègrent encore peu les problématiques touristiques. On ne peut que le regretter.;Disponible;
656;13;2;Guide sur la contructibilité en zone agricole;93;247;Non;01/11/17;51 p.;Non;111;5;Non;Physique & en ligne;Non;http://www.pa.chambagri.fr/uploads/media/GUIDE-CONSTRUCTIBILITE.pdf;3;AMR 00006 (2);Ce guide apporte des précisions sur les principes retenus pour la construction en zone agricole et sur la notion de « nécessité à l'exploitation agricole ». Les bâtiments agricoles sont un élément essentiel du fonctionnement des exploitations agricoles (projet de développement - adaptation - amélioration des conditions de travail). Encadrer la construction en zone agricole en s’assurant de sa nécessité - apparaît comme un enjeu majeur. En tant qu’acteurs du territoire - les agriculteurs sont également responsables de la gestion économe de l’espace agricole - en limitant la consommation et le mitage des zones agricoles. Ce document est destiné : aux élus pour apporter une aide à la décision - aux services instructeurs des collectivités pour faciliter l'instruction des permis de construire - aux agriculteurs qui souhaitent construire en zone agricole pour les éclairer sur la réglementation. Il a pour ambition de concourir à une meilleure préservation de l'espace agricole pour le maintien d’une activité agricole dynamique.;Disponible;
657;21;3;L'Habiter - un impensé de la politique de la ville;70;132;Non;04/01/18;349 p.;Non;111;5;978-2-8159-2719-2;Physique;Non;Non;1;AMU 00185;Cet ouvrage - nourri par de nombreuses recherches et interventions dans les grands ensembles d’habitat social - révèle la diversité de ces quartiers et des modes d’habiter de leurs occupants. Il montre l’importance que représente l’habitat pour ces personnes - et le rôle décisif qu’il joue dans leur inscription dans la société. Dépassant les vaines oppositions entre urbain et social - conditions de vie et cadre de vie - il met en évidence les interactions entre les situations socio_-économiques des habitants - la conception des espaces urbains et leur gestion - ainsi que les politiques publiques qui contribuent à façonner modes d’habiter et situations habitantes. Cette analyse réinterroge les fondements de la politique de la ville et propose une nouvelle conception de l’action.;Disponible;
658;21;3;Touristes et habitants;283;145;Non;01/07/17;171 p.;Non;111;5;978-2-88474-395-2;Physique;Non;Non;1;AMU 00186;Cet ouvrage s’inscrit dans la série proposée par le Laboratoire d’excellence Futurs Urbains (Labex) qui invite deux chercheurs à mettre en regard leurs points de vue sur une question urbaine d’actualité. Marie Delaplace et Gwendal Simon explorent ici les enjeux de la coprésence des touristes et des habitants dans les territoires soumis à l’incidence croissante du tourisme. À partir d’une lecture en termes d’économie résidentielle et touristique - Marie Delaplace souligne la possible complémentarité entre tourisme et économie productive - et entre touristes et habitants. Gwendal Simon plaide pour une approche critique de la catégorisation « touriste et habitant » en soulignant la variété des situations d’entre-deux et des formes de conflits. Il conclut sur la nécessité de politiques dédiées à l’ensemble des usagers d’un territoire - permanents comme occasionnels.;Non disponible;
659;14;13;Les lotissements : Une histoire de l'habitat individuel groupé de 1940 à nos jours;336;259;Non;01/06/17;294 p.;Non;111;5;Non;Physique;Non;Non;1;HAB 00041;Le terme lotissement évoque parfois la « France moche » comme a pu le titrer un grand hebdomadaire français. Cette étude - initiée par le ministère de la Culture - permet de resituer la place de cette forme urbaine depuis la période expérimentale de l’après-guerre jusqu’à nos jours et de réfuter cette image souvent injuste. La sélection présentée dans ce livre offre une variété de contextes et d’organisations à même de révéler les caractéristiques et l’identité des lieux - de créer des paysages cohérents et d’avoir valeur d’exemple du point de vue de l’expérimentation de nouvelles dispositions spatiales ou d’implantation. La majorité des ensembles d’habitat individuel présentés dans cet ouvrage ont été conçus par des architectes - à l’exception de quelques-uns réalisés par des ingénieurs ou d’autres - en autoconstruction.;Non disponible;
660;12;13;Programme Local de l'habitat 2016-2021 de l'Agglomération Côte basque-Adour | Partie I;4;336;Non;01/07/16;119 p.;T1;111;5;Non;Physique;Z:\0_BIBLIOTHEQUE\Documenthèque\_BD_DOC\BD_Docs&Ressources\Habitat_Logement\hab00042_PLH_ACBA_2016-2021_Doc 1_Diagnostic.pdf;http://www.agglo-cotebasque.fr/les-politiques-publiques/habitat-et-politique-de-la-ville/1027-la-politique-locale-de-l-habitat.html;1;HAB 00042;Le défi de ce PLH - contributeur de la cohésion sociale sur le territoire - est de poursuivre les efforts engagés - de renforcer le rôle de régulation de l'action publique pour un développement équilibré de l'habitat tant du point de vue social qu'urbain - permettant à l'ensemble des ménages - dans une logique d'équilibre intergénérationnel - de vivre sur ce territoire et de contribuer à son dynamisme social - culturel et économique. Ce premier tome propose le diagnostic territorial.;Disponible;
661;12;13;Programme local de l'habitat 2016-2021 de l'Agglomération Côte basque-Adour | Parties II - III - IV;4;336;Non;01/07/16;103 p.;T2;111;5;Non;Physique & en ligne;Z:\0_BIBLIOTHEQUE\Documenthèque\_BD_DOC\BD_Docs&Ressources\Habitat_Logement\hab00043_PLH_ACBA_2016-2021_Doc2_orientations_programme_actions.pdf;http://www.agglo-cotebasque.fr/les-politiques-publiques/habitat-et-politique-de-la-ville/1027-la-politique-locale-de-l-habitat.html;1;HAB 00043;Le défi de ce PLH - contributeur de la cohésion sociale sur le territoire - est de poursuivre les efforts engagés - de renforcer le rôle de régulation de l'action publique pour un développement équilibré de l'habitat tant du point de vue social qu'urbain - permettant à l'ensemble des ménages - dans une logique d'équilibre intergénérationnel - de vivre sur ce territoire et de contribuer à son dynamisme social - culturel et économique. Ce deuxième tome compile les parties II : Orientations et objectifs  - III : Programme d'actions  - et IV : Territorialisation. ;Disponible;
647;21;10;Le patrimoine naturel du Pays Basque;376;24;Non;01/07/17;104 p.;Non;111;5;979-10-93512-06-8;Physique;Non;Non;1;ENV 00077;"Publier une série d'articles sur le patrimoine naturel peut paraître un paradoxe pour le bulletin d'un musée dit de société. On pouvait attendre cela d'un écomusée ou d'un muséum d'histoire naturelle. La Société des Amis du Musée Basque a accepté toutefois la proposition du Conseil de développement du Pays Basque (CDPB) de mener à bien une action particulière - celle de réunir des contributeurs d'horizons différents pour explorer ce sujet. Cette publication est aujourd'hui une des actions retenues dans le cadre du chantier organisé sur le patrimoine naturel par le CDPB. Chemin faisant - le paradoxe initial s'est estompé tant le patrimoine naturel se trouve à la croisée de la culture et de la nature. Bien sûr - des points de vue variés s'expriment ici - ce qui en fait tout l'intérêt. Plusieurs auteurs donnent priorité aux composantes écologiques comme les écosystèmes et la biodiversité. D'autres y voient plutôt les paysages qu'ils soient ruraux ou urbains. D'autres encore le regardent au travers de la mythologie ou des arts. Et certains choisissent le prisme des activités comme le tourisme et l'agriculture - ou des espaces concernés comme le littoral. Entre nature et culture - entre développement et protection - entre conservation et transmission - entre choix individuel et collectif - le patrimoine naturel du Pays Basque est apparu mal connu et peu décrit. Il est pourtant riche et varié et participe largement à la qualité de ce pays.  L'AUDAP a participé a ce travail en proposant une contribution : ""La nature et la ville : vers une reconciliation ?"".";Non disponible;
655;12;20;La transition urbaine ou le passage de la ville pédestre à la ville motorisée;281;66;Non;01/01/99;149 p.;Non;111;5;2-87009-703-4;Physique;Non;Non;1;AMU 00183;Marc Wiel met en lumière les effets de la « mobilité facilitée » sur la ville : le passage d’une ville condensée à métrique piétonne à une ville éparpillée voire éclatée à métrique principalement automobile - à la recherche d’une nouvelle identité culturelle et institutionnelle.;Disponible;
654;21;3;Ville et numérique : évolution - transition - révolution…;57;282;Non;01/01/18;50 p.;Non;12;5;Non;Physique & en ligne;Non;http://www.revue-belveder.org/wp-content/uploads/PDF/N2/BelvedeRn02.pdf;1;AMU 00184;« Ville et numérique » - un numéro de Belvede_ dans l’air du temps… certainement - mais non pas par effet de mode mais par conviction : la présence accrue des outils numériques dans nos vies comme dans nos villes - a des impacts considérables et vient bousculer profondément les manières de vivre - de penser - et de faire la ville et les territoires. Il s’agit d’éclairer ce qui se joue aujourd’hui sous nos yeux et que l’on peine à qualifier _ une évolution - une transition - une révolution… _ mais dont nous sommes tous acteurs. Les articles de ce nouveau numéro de Belvede_ proposent ainsi un décryptage des mutations dont le numérique est le levier - en matière de commerce - d’économie - d’innovation - de déplacement - d’emploi… Ils donnent à voir des expérimentations porteuses d’avenir comme des évolutions qui font déjà notre quotidien.;Disponible;
653;21;3;Densité - architecture et territoire - Cinq histoires européennes;242;134;Non;31/12/16;199 p.;Non;111;5;978-3-86859-436-2;Physique;Non;Non;1;AMU 00182;Le livre propose une réflexion sur la densité comme modèle de développement durable. Basé sur l'analyse de cinq projets urbains et architecturaux en Europe - à travers leur dimension physique - économique et sociale - l'ouvrage montre que la densité constitue le socle urbain des relations humaines et le cadre de l'épanouissement des sociétés contemporaines. ;Disponible;
639;12;3;Berlin - Le génie de l'improvisation;51;70;Non;08/09/17;224 p.;Non;121;5;978-2-86364-249-8;Physique;Non;Non;1;AMU 00175;"Ce livre prolonge l'atelier ""projet urbain"" qui s'est déroulé à Berlin les 18 et 19 septembre 2017. Les architectes urbanistes explorent la politique de Berlin face à la gentrification - à la croissance démographique - à la montée des prix de l'immobilier et aux déficits publics. Ils montrent comment la ville met en place ses stratégies pour accueillir les habitants - les touristes et les entreprises : partenariats public-privé - initiatives citoyennes - actions sociales et économiques - entre autres.";Non disponible;
652;21;1;Les dossiers FNAU #34 | Les agences d'urbanisme en régions;174;167;Non;01/04/15;27 p.;Non;111;5;1295-5760;Physique & en ligne;Non;http://www.fnau.org/wp-content/uploads/2016/03/FNAU-34-REGIONS-PDF-BD-DEF.pdf;3;AMT 00069 (2);Les dossiers de la FNAU # 34 illustre la diversité et la richesse des coopérations entre les régions et les agences dí'urbanisme et montre les premiers travaux qui s'íesquissent au sein du réseau de la FNAU pour décrypter les dynamiques et les enjeux des nouvelles entités régionales.;Disponible;
651;21;20;Assises nationales de la Mobilité - Contribution de la Région Nouvelle-Aquitaine;356;47;Non;22/01/18;27 p.;Non;111;5;Non;Physique & en ligne;Non;https://issuu.com/conseilregional/docs/contributionregionassisesnationales;1;TRA 00063;Les Assises nationales de la Mobilité lancées en fin d'année 2017 ont permis la mobilisation de l'ensemble des acteurs autour des thématiques de la mobilité - en accordant une attention particulière aux transports de la vie quotidienne - aux zones rurales et périurbaines. Les élus et les services de la Région-Aquitaine ont ainsi contribué aux différents ateliers d'experts nationaux - et ont participé activement à l'organisation des ateliers territoriaux. Au regard de ses compétences en matière de transport de voyageurs - d'intermodalité - logistique - et d'aménagement du territoire - la Région Nouvelle-Aquitaine a souhaité alimenter la réflexion sous la forme d'une contribution. La Région Nouvelle-Aquitaine propose un certain nombre de réponses à ces enjeux et de mesures lui permettant - aux côtés des autres acteurs de la mobilité - de poursuivre ses missions avec la plus grande efficience possible. Désireuse de satisfaire au mieux les besoins de mobilité des habitants et acteurs de tous les territoires la composant - la Région Nouvelle-Aquitaine entend ainsi accélérer les évolutions nécessaires de ses infrastructures - systèmes et services de transports - au service de l'ensemble de la population.;Non disponible;
650;21;3;Villes et territoires en diagonale;345;70;Non;06/12/17;191 p.;Non;111;5;978-2-86364-217-7;Physique;Non;Non;1;AMU 00181;"Comment la recherche peut-elle nourrir l'action ? Et réciproquement ? Qui pour répondre à la question si ce n'est un chercheur engagé et atypique - ayant osé s'impliquer dans l'opérationnel ? Qui mieux que Pierre Veltz ? Ingénieur - sociologue et économiste - enseignant et chercheur n'appartenant à aucune chapelle - Pierre Veltz est passé à l'action à travers son engagement dans la création du Grand Paris et dans le pilotage de l'aménagement du plateau de Saclay. Les réponses qu'il propose - claires et généreuses - sont d'autant plus précieuses que la période est confuse et que l'urbanisme et l'aménagement peinent à se redéfinir face aux bouleversements économiques - sociaux et environnementaux à l'oeuvre depuis le début du XXIe siècle. Pierre Veltz lutte contre la morosité ambiante en démontrant que les villes et les territoires jouent un rôle central dans la capacité de la France à affronter les défis de la mondialisation - de la révolution numérique et de la mutation écologique. Il s'interroge sur l'évolution des relations entre Paris et les capitales régionales et sur une possible ""métropole France en réseaux"" qui ne feraient pas l'impasse sur la ruralité et les territoires peu denses. L'ouvrage explore de nombreuses pistes avec des complices et des responsables institutionnels sur des sujets aussi divers que l'avenir de la métropole francilienne - l'avenir du travail et de l'industrie ou l'idée d'une ""Agence France"" qui penserait le territoire national comme un projet - considérant l'aménagement du territoire et l'aménagement urbain comme un même combat ! L'ouvrage présente également les trois nominés au Grand Prix - Jacques Lévy - géographe et chercheur de renommée internationale - favorable à un territoire dense et économe - Alfred Peter - paysagiste engagé dans le durable et le rôle des transports comme moteur de l'urbanité frugale et Philippe Madec - architecte-urbaniste qui a anticipé le développement durable avant la lettre comme mode de pensée et d'action.";Disponible;
649;21;3;La ville agricole;357;72;Non;01/05/17;72 p.;Non;111;5;978-2-9561008-0-5;Physique;Non;Non;1;AMU 00180;L'agriculture vit une révolution urbaine sans précédent traduisant un changement de civilisation profond sans doute aussi conséquent que celui qui s'est produit au Néolithique. En Europe - moins de 4 % de la population vit désormais directement de l'agriculture - à l'échelle mondiale la population est depuis quelques années majoritairement urbaine. Plus une société est urbaine et plus elle est nécessairement agricole - au moins en termes de besoins nourriciers - et pourtant l'agriculture et la ville restent aujourd'hui largement séparées dans leur pensée et leur développement alors qu'elles sont totalement liées et indissociables. L'agriculture est indéniablement urbaine et la ville agricole - et ces deux projets se doivent d'être assumés comme communs. C'est ainsi les fondements de cette révolution urbaine que cet ouvrage tente d'explorer et interroge brièvement et de manière non exhaustive les formes et les moyens possibles de cette transition nourricière - environnementale et urbaine indispensable de l'agriculture - dirigée vers la construction d'une ville consciemment agricole - imaginative et vivante.;Disponible;
642;21;3;Traits d'agence : construire l'Europe des lieux et des liens;174;167;Non;01/11/17;27 p.;Non;111;5;1776-9604;Physique & en ligne;Non;http://www.fnau.org/wp-content/uploads/2017/10/ta-31-web-ok.pdf;1;AMU 00178;Le Traits d’Agences d’automne 2017 est consacré à la 38e Rencontre Nationale des Agences d’Urbanisme qui sera accueillie par l’Eurométropole de Strasbourg les 8 - 9 et 10 novembre prochains autour du thème « Construire l’Europe des lieux et des liens » . Au moment où l’Union Européenne est face à une étape de refondation - avec dans les mois à venir la mise en place d’un nouvel agenda post-Brexit et post-2020 - afin de définir un nouveau projet européen - le réseau des agences s’interrogera au cours de ces journées sur une question centrale : « Et si les territoires étaient la chance de l’Europe ? ». En effet - pour cette refondation - l’Europe ne doit pas être seulement une affaire d’États : pour susciter l’adhésion - un nouveau projet européen devra nécessairement s’inscrire de façon forte dans les réalités territoriales et dans les expériences concrètes des individus. Ce numéro présente ainsi un aperçu de la diversité des actions des agences d’urbanisme sur les liens européens avec les collectivités - l’État et l’ensemble des acteurs avec lesquelles elles travaillent - illustrant la volonté du réseau d’apporter sa contribution à la construction de ce nouvel agenda européen.;Disponible;
445;21;1;Abécédaire - Systèmes territoriaux régionaux;174;167;Non;01/01/16;90 p.;Non;111;5;Non;Physique & en ligne;Z:\0_BIBLIOTHEQUE\Documenthèque\_BD_DOC\BD_Docs&Ressources\Aménagement_du_Territoire\AMT00063_Abcdaire_SystemesTerritoriaux_FNAU.pdf;Non;1;AMT 00063;"La FNAU a choisi d'éclairer prioritairement les enjeux des territoires français sous l'angle des ""interrelations"" et des ""coresponsabilités"" territoriales. Plusieurs idées directrices auxquelles sont attachées les agences d'urbanisme guident ce travail:  l'approche pour les liens et la gouvernance pour la co-construction territoriale - l'analyse par les ""écosystèmes économiques et d'innovation"" - la connaissance par les flux pour appréhender la ""société mobile et connectée"" - les ""biens communs"" pour aborder les politiques territoriales - le développement humain et la qualité de vie pour aborder les disparités et les enjeux de cohésion territoriale. ";Non disponible;
648;1;13;Les oubliés du logement;54;286;Non;25/08/17;71 p.;Non;111;5;Non;Physique & en ligne;Non;http://entretiensinxauseta.fr/wp-content/uploads/2017/11/ACTES-ENTRETIENS-2017.pdf;1;HAB 00040;Les Entretiens d’Inxauseta du 25 août 2017 ont abordé deux questions essentielles de l’équilibre des territoires et de la qualité de vie des habitants - notamment les plus fragiles. Ce thème est les oubliés du logement.;Disponible;
646;21;3;Vers un urbanisme collaboratif;174;167;Non;01/09/17;139 p.;Non;111;5;978-2-07-273091-7;Physique;Non;Non;1;AMU 00179;Un relatif consensus émerge sur la nécessité d’intégrer les individus dans les projets d’aménagement et sur cette transformation dans la représentation du citoyen-habitant-usager et dans le rôle de l’individu comme « partie prenante » du territoire (et plus seulement - comme bénéficiaire ou consommateur passif). Pourtant un décalage reste de mise entre les discours et leur concrétisation – décalage qui contribue à exacerber attentes et frustrations - au sein d’une société civile dont les capacités d’organisation montent par ailleurs en puissance. Mode essentiel du dialogue entre décideurs et citoyens - la concertation autour des politiques publiques et des projets urbains ne semble plus à la mesure de l’enjeu. Dorénavant - il faut inverser le regard pour considérer l’ensemble des acteurs du territoire – institutionnels - économiques - associatifs ou particuliers - - comme autant de ressources et de moteurs pour son développement. Cette reconfiguration des rôles ne va pas de soi. Elle impose de revisiter les bases communes de réflexion et d’action collective. Les agences d’urbanisme disposent d’une longue et solide expérience du « faire avec » les institutions - mais aussi la sphère économique. Désormais - elles contribuent à la construction d’un savoir-faire professionnel - susceptible de faciliter l’émergence d’un « faire avec » les individus – usagers - habitants et citoyens.;Disponible;
643;21;9;Des patrimoines à l'économie - réinventons les politiques de nos territoires;259;117;Non;01/11/17;66 p.;Non;111;5;Non;Physique;Non;Non;1;ECO 00044;"Le deuxième congrès national de l'association Sites et Cités remarquables de France s'est tenu à Calais les 28 et 29 septembre 2017 autour du thème : ""Des patrimoines à l'économie - réinventons les politiques de nos territoires"". Le nouveau numéro hors-série de la revue Urbanisme - réalisé en partenariat avec Sites & Cités remarquables - rend compte des travaux et problématiques de ce congrès : comment mieux faire connaître ces patrimoines - aux multiples formes (historique - architectural - urbain - paysager - culturel - gastronomique - etc.) ? Comment faire en sorte qu'ils participent au développement durable du territoire et à la qualité de vie de ses habitants ? Quels partenariats susciter entre les collectivités et l'Etat pour échafauder des projets touristiques et les vendre ? Par ailleurs - le besoin urgent d'une requalification urbaine - commerciale - culturelle des centres-ville anciens justifie l'appel lancé lors du congrès par les collectivités locales aux pouvoirs publics nationaux pour que soient prises les mesures d'accompagnement nécessaires. La valorisation des patrimoines peut en effet devenir un levier de reconquête de ces centres anciens. ";Disponible;
