N°;type-id;thematic-id;Titre;author-id;editor-id;Mentions d'édition;Date de publication;Pagination;Tomaison;collection-id;language-id;ISSN - ISBN;Support;Adresse Document Source;Lien URL;localisation-id;Cote;Résumé;Statut;
845;9;1;Udalplan 2020;169;170;Non;01/02/21;111 p.;Non;111;3;1889-7940;Physique;Non;Non;1;AMT 00109;Ce document comprend : le système d'information géographique et banque de données territoriales de la CAPV  - les indicateurs territoriaux de durabilité territoriale et urbanistique  - l'inventaire de planification générale du territoire. ;Disponible;
844;17;10;Paysage de la santé - santé du paysage;152;208;Non;01/10/20;240 p.;N°34;111;5;978-2-330-13582-9-;Physique;Non;Non;1;ENV 00106;Alors qu’il s’agit désormais de s’interroger sur les conditions concrètes et matérielles de la réalisation d’un monde vraiment habitable - la dimension sanitaire de l’environnement ne doit pas être placée au second plan - loin derrière les données économiques et sociales. Car la santé participe pleinement de la réalisation de soi et de la liberté.;Disponible;
843;11;18;Le bonheur était pour demain;333;31;Non;01/04/19;384 p.;Non;8;5;978.2.02.138861.9;Physique;Non;Non;1;HUM 00041;"""Pendant des siècles - les chantres du progrès par la technique et la science appliquée ont promis à l’humanité le bonheur pour demain - ou au plus tard après-demain. L’emballement numérique - la perspective de technologies « révolutionnaires » ou « disruptives » - les limites sans cesse repoussées - les annonces tonitruantes de milliardaires high-tech ont redonné un nouveau souffle aux promesses d’un monde technologique meilleur - d’abondance et de bonheur pour tous - de l’immortalité à la conquête spatiale - en passant par les énergies « propres » et la capacité à « réparer » une planète bien fatiguée. Non content de tailler en pièces ce « technosolutionnisme » béat - du passé comme du présent - ignorant les contraintes du monde physique et de ses ressources limitées - l’auteur questionne aussi les espoirs de changement par de nouveaux modèles économiques plus « circulaires » ou le pouvoir des petits gestes et des « consomm’acteurs » - face aux forces en présence et à l’inertie du système. Une fois balayées les promesses mystificatrices ou simplement naïves - rien n’empêche de rêver - mais les pieds sur terre : nous pouvons mettre en œuvre - dès maintenant et à toutes les échelles - une foule de mesures salutaires. Et si - finalement - le bonheur était bien pour demain ?";Disponible;
842;11;3;Et si… on libérait notre imagination pour créer le futur que nous voulons ?;364;335;Non;01/01/20;336 p.;Non;45;5;978-2-330-13285-9;Physique;Non;Non;1;AMU 00249;Et si… le pouvoir de changer le cours des choses en profondeur était entre nos mains ?  Et si… en réalité - nous avions à disposition - sans en avoir vraiment conscience - un des outils les plus puissants qui existent ? Et si… en plus - on se mettait ensemble pour y arriver ?  Rob Hopkins nous invite à rêver en remettant l’imagination au cœur de nos vies quotidiennes. John Dewey définit l’imagination comme la possibilité de regarder les choses comme si elles pouvaient être autres. C’est cette capacité de pouvoir dire “Et si…” et d’envisager un autre monde plus en cohérence avec nos aspirations et les besoins de notre société.  En ces temps de catastrophes climatiques - de perte de biodiversité - d’insécurité alimentaire - d’appauvrissement des écosystèmes et de crises communautaires - notre futur – sans parler de notre présent – semble plutôt sombre. Pourtant - comme nous le rappelle Rob Hopkins - des changements drastiques - rapides et inattendus sont possibles - et ce pour le meilleur. Il a pu observer les améliorations en cours partout dans le monde. Des individus et des communautés ont d’ores et déjà emprunté le chemin de l’imagination.  Dans cette exploration passionnée - Rob Hopkins interroge le déclin de notre imagination et la manière dont nous pourrions lui redonner de la vigueur. Car - une fois qu’on l’aura fait - plus rien ne nous résistera. Et si… ? est un appel à l’action pour libérer notre imagination collective et initier des changements rapides et profonds pour un meilleur futur.;Non disponible;
841;14;4;ETXEA - La maison et l'habitat au Pays basque;260;178;Non;01/11/20;120 p.;Non;3;5;978-84-9027-075-8;Physique;Non;Non;1;ARC 00010;Etxea - c’est l’élément iconique du Pays Basque - qu’on admire autant qu’on en raconte tout et n’importe quoi. Il n’existait aucun ouvrage de synthèse à la fois sérieux - complet et récent sur ce sujet pourtant archi réclamé. Depuis son impérissable « Etxea ou la maison basque » en 1979 - l’association Lauburu s’est imposée comme la seule spécialiste du patrimoine bâti basque. Ce livre est donc une référence appelée à être durable. ;Disponible;
840;21;1;Traits d'agence : Explorons nos futurs (heureux);174;143;Non;01/10/20;24p.;Non;137;5;Non;En ligne;Non;http://www.fnau.org/wp-content/uploads/2020/10/ta-37-ok-bd.pdf;2;AMT 00107;Représenter nos futurs ! C’est sous le signe de la prospective qu’a été imaginée la 41e rencontre des agences d’urbanisme qui sera organisée en décembre en distanciel par l’agence d’urbanisme de Brest Bretagne (Adeupa) et par la Fnau. Pour préparer la 41e rencontre - les agences d’urbanisme ont décidé de travailler en réseau sur les changements à l’horizon 2040 pour imaginer un « monde d’après » qui aurait réussi à relever les défis des transitions. Questionner l’avenir par les notions de bonheur et de bien-être - de développement durable et de transition écologique réussie - peut sembler naïf - mais c’est ce postulat de futurs souhaitables - mais voulus aussi crédibles - qu’a décidé de retenir le réseau des agences d’urbanisme pour cette démarche de prospective commune - conduite en lien avec l’ANCT et l’École urbaine de Lyon. Ce numéro de Traits d’agences présente différentes facettes des démarches de prospective conduites dans les territoires par les agences d’urbanisme. Certaines se fondent sur la résilience face à la crise de la Covid-19 - d’autres s’appuient sur des imaginaires territoriaux ou des démarches ludiques pour questionner les projets de territoire ou l’émergence de nouvelles politiques publiques mises à l’agenda. L’horizon temporel retenu est souvent 2040 - il représente trois mandats politiques ou encore une génération.;Disponible;
839;21;3;Ville du futur - ville sûre !;271;108;Non;07/12/20;82 p.;Non;111;5;Non;Physique;Non;Non;3;AMU 00248(2);"Santé - surveillance - cybersécurité - résilience - mobilités... Pour la troisième année consécutive - « La Gazette des communes » - « Le Moniteur » - « L’Usine nouvelle » et « L’Usine digitale » - quatre médias professionnels - référents dans leur secteur - se sont associés pour réaliser un numéro spécial consacré à la ville du futur. Et plus particulièrement - la ""safe city"" - ou ""ville sûre"" - dans toutes ses dimensions.";Disponible;
838;21;1;Six décennies d'anticipation en Île-de-France de A à Z;215;137;Non;01/12/20;128 p.;Non;111;5;978-2-7371-2159-3;Physique & en ligne;Non;https://www.institutparisregion.fr/amenagement-et-territoires/six-decennies-danticipation-en-ile-de-france.html;1;AMT 00108;Le présent ouvrage met à l’honneur le principe de l’anticipation - de la vision à long terme - si caractéristique de L’Institut - si nécessaire pour rester dans le coup. En cet anniversaire - le second principe mis à l'honneur est celui de l'humain - les hommes et les femmes qui ont fait et font toujours L’Institut et ses travaux au service de la région - leur esprit pionnier - leur intelligence - leurs compétences - leur sens de la didactique - leur esprit d’équipe - leur bienveillance. Les auteurs de cet ouvrage en offrent un très bel échantillon. Certains ont été de grandes figures qui ont marqué de leurs travaux les réalités de notre Île-de-France d’aujourd’hui. Par le croisement des plumes des actifs et des anciens - ces auteurs nous offrent un témoignage vibrant du continuum de leur culture et de leur attachement à L’Institut.;Disponible;
837;14;3;Lire la ville - Manuel pour une hospitalité de la ville;95;191;Dominique Carré éditeur;24/09/20;255 p.;Non;111;5;978-2-37368-049-2;Physique;Non;Non;1;AMU 00246;Ce livre est un manifeste pour la ville. Ce n’est ni un pamphlet ni une critique amère ou nostalgique de notre réalité. C’est un manuel pratique qui s’adosse à une pensée et à une éthique de la ville - qui part de l’existant et tente de le saisir. L’ouvrage croise les dimensions spatiales et sociales de la ville. Il ne cherche pas à convaincre. Il expose - pas à pas - le bénéfice que représenterait pour tous - individuellement et collectivement - un espace public civil - favorisant la citoyenneté - l’égalité et la solidarité. L’ouvrage - composé de 19 entrées thématiques (bancs - sols - gares - sûreté urbaine…) - propose un choix de préconisations qui - sans prétendre à l’exhaustivité ni à la perfection - tendent vers une éthique des interventions dans la ville. Chaque entrée - éclairée par les enjeux anthropologiques et politiques de l’espace public - comporte des recommandations - explore des aspects pratiques - évoque quelques-unes de ses dimensions sémantiques - historiques ou artistiques. Des exemples - des contre-exemples - des illustrations - une marche à suivre permettent de penser les différentes problématiques en regard de cas concrets. L’ouvrage intéressera tout un chacun - des élus et des aménageurs aux amoureux de la poétique urbaine.;Disponible;
836;2;3;Atlas des mondes urbains;163;34;Laurence de Bélizal - Nathalie David - Nathalie Larmanjat;30/10/20;143 p.;Non;111;5;978-2-7246-2610-0;Physique;Non;Non;1;AMU 00245;Aux sources classiques des organisations internationales et des réseaux de villes - les auteurs de cet Atlas des mondes urbains ont confronté l'éventail des nouvelles possibilités offertes par le numérique - multiplié les échelles et se sont affranchis des spatialités territoriales usuelles. Voici une cartographie inédite de la planète des citadins. Sept humains sur dix vivent en ville. Des mégapoles se forment sur tous les continents. Partout le bâti s'étale et se standardise - les mondes ruraux disparaissent - les modes de vie s’uniformisent et - dans le même temps - les inégalités se creusent. La généralisation de l’urbain réchauffe la planète - détruit la biodiversité et nous rend encore plus vulnérables face au changement climatique. Mais les villes sont aussi notre bien commun. Elles sont des lieux de production de richesses - d’innovation - de création culturelle - de solidarité et de résilience. Elles fascinent par leur gigantisme - leurs foules et leurs innombrables activités - laissant dans l’ombre une autre réalité : la myriade de villes petites et intermédiaires qui composent l’essentiel des mondes urbains d’aujourd’hui. Celles des pays dits en développement - en particulier - dont les « basses technologies » sont loin d’affecter autant l’avenir de la planète que les métropoles mondialisées.  Pour explorer les mondes urbains - les auteurs de cet atlas ont défriché de multiples champs hétéroclites. Aux sources classiques des organisations internationales et des réseaux de villes - ils ont confronté l’éventail des nouvelles possibilités offertes par le numérique - multiplié les échelles et se sont affranchis des spatialités territoriales usuelles. Voici une cartographie inédite de la planète des citadins. ;Disponible;
835;11;18;Le macroscope - vers une vision globale;246;204;Points;01/01/75;346 p.;Non;111;5;978.2.7578.4113.6;Physique;Non;Non;3;HUM 00040 (2);"Le macroscope - Qu'y a-t-il de commun entre l'écologie - le système économique - l'entreprise - la ville - l'organisme - la cellule ? Rien - si on se contente de les examiner avec l'instrument habituel de la connaissance - l'approche analytique. Mais beaucoup - en revanche - si l'on dépasse cette démarche classique pour faire ressortir les grandes règles d'organisation et de régulation de tous ces "" systèmes "". Pour Joël de Rosnay - l'instrument symbolique de cette nouvelle manière de voir - de comprendre et d'agir est le "" macroscope "" - qui devrait être aussi précieux aujourd'hui aux grands responsables de la politique - de la science - de l'industrie - et à chacun de nous - que le sont le microscope et le télescope pour la connaissance scientifique de l'univers.";Disponible;
834;1;13;Imaginons une politique de l'habitat ambitieuse - juste - éco-responsable;273;105;Non;01/08/20;88 p.;Non;111;5;Non;Physique & en ligne;Non;http://entretiensinxauseta.fr/les-actes-des-entretiens-2020/;3;HAB 00054;Le déclenchement de la crise sanitaire du Covid-19 et la récession économique de grande ampleur qu’elle a provoquée vont fortement impacter le secteur du logement et de l’habitat - dans la durée probablement. Avec la chute de la construction sociale et privée - l’effondrement des marchés de la transaction et la destruction d’une partie de l’appareil de production - les déséquilibres quantitatifs ne vont que s’aggraver. Les Entretiens d’Inxauseta proposaient cette année de travailler sur ce que devra être une politique du logement et de l’habitat ambitieuse - juste - solidaire - et écoresponsable au service des citoyens et de la société. Il ne peut s’agir de simples réflexions - il s’agit de participer à la reconstruction d’une véritable stratégie claire - transparente - acceptée et appropriée … et qui soit dotée des moyens nécessaires pour réussir.;Disponible;
833;14;7;Le pilotage des politiques publiques locales;133;265;Non;01/10/20;622 p.;Non;111;5;978-2-7013-2029-8;Physique;Non;Non;1;COL 00017;Les collectivités locales voient - depuis quelques années - leurs compétences s'accroître et les moyens financiers pour les mettre en oeuvre diminuer. Elles doivent donc faire plus avec moins et sont à la recherche d'une plus grande efficacité dans la gestion des politiques publiques locales. Planifier - organiser et évaluer l'ensemble des actions et activités d'une organisation publique sont des missions du quotidien pour les collectivités locales. Les enjeux sont multiples : responsabiliser dans la consommation des ressources  - formaliser la stratégie de la collectivité  - permettre à la population de mieux connaître les actions menées par la collectivité  - adapter l'offre de services publics locaux aux besoins de la population... Cet ouvrage répond donc à une triple ambition : - conceptuelle : en stabilisant les différents concepts qui régissent les politiques publiques locales  - - pratique : en s'appuyant sur les innovations locales des 20 dernières années  - - normative : en proposant une méthodologie appliquée aux collectivités.;Non disponible;
832;13;20;Le nouveau guide des chicanes et écluses sur voiries urbaines;85;195;Collection Références;18/04/12;83 p.;Non;37;5;978-2-11-129469-1;Physique;Non;Non;4;TRA 00068;La modération de la vitesse en ville est une nécessité tant pour la sécurité routière que pour la qualité de vie et la convivialité. L'aménageur doit évidemment convaincre mais aussi parfois contraindre les usagers motorisés à ajuster leur vitesse en fonction des conditions rencontrées. Le guide des chicanes et écluses sur voiries urbaines donne les caractéristiques techniques et les domaines d'utilisation de ces outils d'aménagement. Correctement implantées - dimensionnées et signalées - les chicanes et écluses obligent les conducteurs à respecter la vitesse réglementaire - sans causer de gêne excessive à ceux qui la respectent déjà. Ce guide s'adresse aux aménageurs de voirie et devrait les aider à juger de l'opportunité d'utiliser de tels aménagements - qui ne sont pas les seuls permettant de modérer les vitesses. Il vient en aval de guides généraux portant sur une démarche plus globale d'étude d'aménagement - tels que par exemple les guides Le profil en travers - outil de partage des voiries urbaines ou l'aménagement d'une traversée d'agglomération - une démarche de projet.;Disponible;
830;11;18;La convivialité;220;31;Non;28/08/14;15 p.;Non;119;5;Non;Physique;Non;Non;1;HUM 00039;L'analyse critique de la société industrielle doit beaucoup à Ivan Illich. Il est l'un des premiers à avoir dénoncé le productivisme - le culte de la croissance - l'apologie de la consommation et toutes les formes d'aliénation nées du mode de production capitaliste. La Convivialité montre comment l'organisation de la société tend à produire des consommateurs passifs - qui ont délégué aux institutions le pouvoir de décider et renoncé à assumer la responsabilité des orientations de leur société. Cette analyse critique se transforme en un manifeste. Il s'agit de réveiller politiquement les citoyens endormis - afin qu'ils se réapproprient leur destin. Toutefois - cette reconquête suppose que les individus se détournent des seules possessions matérielles au profit de la redécouverte d'autrui et de la pratique du dialogue social. Seul l'apprentissage de la convivialité permettra - par la rencontre et l'échange - de renouer les fils de la communauté et de lui redonner la maîtrise de son avenir et de ses choix. -;Non disponible;
829;21;1;L'Ibérie atlantique;341;132;Non;01/01/96;100 p.;Non;135;5;2-87678-256-1;Physique;Non;Non;1;AMT 00106;Du pays basque à la Galice - des Asturies à la Navarre - l’Ibérie atlantique englobe - jusqu’au Nord Portugal - une succession de territoires hétérogènes et cloisonnés. Leur voisinage géographique ne suffit pas à rassembler ces régions - aux trajectoires historiques et économiques diverses - dont les métropoles - jalouses de leurs prérogatives - tendent à se replier sur elles-mêmes et sur leur arrière-pays immédiat. À l’heure où la disparition progressive des industries traditionnelles semble inéluctable - dans le contexte de l’unification européenne souvent oublieuse des périphéries - cette façade éclatée se voit fragilisée par des bouleversements économiques sans précédent. La fédération de ses régions au sein de l’Arc atlantique pourrait contribuer à atténuer les rivalités des villes et à rééquilibrer leurs relations avec leur territoire. L’ouverture des flux en direction de la façade française et du reste du continent s’impose autant que le développement de réseaux cohérents au sein de ces littoraux en quête d’Europe. Après « Espaces-projets atlantiques » - cet ouvrage - dirigé par Pierre Laborde - propose un itinéraire parmi les particularités territoriales et économiques de ce front de mer situé entre Atlantique et Méditerranée - aux situations riches d’enseignements pour la prospective de la façade atlantique.;Disponible;
828;21;13;R-EVOLUTION : Low-Tech vs. High-Tech - le bâtiment comme enjeu de reconciliation ?;317;82;Non;10/10/19;44 p.;Volume 2;111;5;Non;Physique;Non;Non;1;HAB 00053;A l’heure où les procédés de construction sont tournés vers le numérique et les nouvelles technologies - on observe un certain « retour aux sources » enclenché par l’arrivée en masse de nouvelles réglementations énergétiques et environnementales. Presque comme un phénomène de mode - biosourcés - recyclage - réemploi - etc. - sont autant de termes émergents ces dernières années - et qui posent des questions relatives aux procédés de mises en œuvre - aux limites constructives - et aux compétences engagées.;Non disponible;
827;21;10;Villes et territoires de l'après-pétrole - Le paysage au cœur de la transition;269;109;Non;26/08/20;320 p.;Non;111;5;978-2-281-14425-3;Physique;Non;Non;4;ENV 00105;Villes et territoires de l’après-pétrole expose les principes issus d’une réflexion pluridisciplinaire engagée par les membres du collectif Paysages de l’après-pétrole depuis quatre années - démontrant que l’approche paysagère est le fil conducteur de la transition énergétique et du développement durable des territoires. La démarche paysagère - au-delà de solutions en matière de transition énergétique - permet d’élaborer un « monde d’après » - en conciliant enjeux économiques - respect de l’environnement et amélioration du cadre de vie et des relations humaines. Parmi ses principes : l’autonomie des territoires - le respect des diversités et équilibres naturels - la valorisation et la mise en réseau des initiatives locales - la complémentarité entre villes et campagnes - et l’intégration des énergies renouvelables dans une stratégie d’ensemble visant la construction d’un paysage vert et apaisé. Les solutions proposées - que différents territoires ont su mettre en oeuvre aux échelles de la ville comme de la campagne - sont détaillées et analysées au sein de six chapitres thématiques. Richement illustrés - ils exposent l’expertise des membres du collectif sur l’énergie - l’habitat - l’agriculture et les outils - métiers - formations et acteurs du paysage. Professionnels et étudiants de l’aménagement du territoire - élus - spécialistes en sciences politiques et sciences humaines et sociales - membres des associations culturelles - d’éducation et de solidarité sociale ou environnementale y trouveront un guide précieux pour anticiper et prendre part à l’élaboration des paysages de demain.;Disponible;
826;21;1;Zéro artificialisation nette - une équation complexe pour les politiques publiques;174;167;Non;01/06/20;8 p.;Non;111;5;Non;Physique & en ligne;Non;http://www.fnau.org/wp-content/uploads/2020/06/avis-fnau-n9-zan_v5.pdf;1;AMT 00107;Issu de la « Feuille de route pour une Europe efficace dans l’utilisation des ressources » de la Commission européenne - l’objectif de zéro artificialisation nette (ZAN) a été mis à l’agenda politique gouvernemental en France dans le cadre du plan biodiversité et a été inscrit dans des programmes politiques pour les élections municipales et régionales. Il représente une équation complexe pour les politiques publiques.;Disponible;
825;21;1;Traits d'agence : Lost in Transition - comment re-lier les territoires;174;167;Non;22/10/19;23 p.;Non;111;5;1776-9604;Physique & en ligne;Non;http://www.fnau.org/wp-content/uploads/2019/10/ta-35-hd.pdf;1;AMT 00105;La 40e Rencontre des agences d’urbanisme se tient dans la région Île-de-France les 6 - 7 et 8 novembre 2019. Accueillie par L’Institut Paris Région présidé par Valérie Pécresse - présidente de la région Île-de-France - la Rencontre est l’occasion de trois journées d’échanges et de co-construction sur les différents champs de la transition et de la coopération territoriale. Défendue - valorisée - voire érigée en modèle de développement urbain - la métropolisation est aussi désormais régulièrement critiquée parce qu’elle conduirait à une division de l’espace et de la société. Alors - comment re-lier les territoires ? La réponse à cette question tient peut-être dans un postulat : celui de la transition qui mettra en valeur les ressources propres à chaque territoire. Démontrer l’indissociable dépendance des territoires face à cet enjeu majeur - tel est le pari de cette 40e Rencontre. Cette nécessaire adaptation aux mutations par la transition nécessite un renforcement des liens entre les territoires à travers des stratégies de coopération. Par leur capacité à se fédérer - les territoires seront bien plus en mesure de relever les différents défis écologiques - économiques et sociaux. Cela suppose une mise en cohérence - une gouvernance organisée entre les différents acteurs et échelles territoriales. Ce numéro de Traits d’agences associé à la Rencontre présente différentes initiatives des agences d’urbanisme en faveur de la transition. Il donne à voir sur le rôle des agences auprès des territoires - des collectivités et de l’Etat dans un moment de profonde transformation mais tente également de réinterroger les modes de faire et ouvrir les champs d’investigation. ;Disponible;
