N°;type-id;thematic-id;Titre;author-id;editor-id;Mentions d'édition;Date de publication;Pagination;Tomaison;collection-id;language-id;ISSN - ISBN;Support;Adresse Document Source;Lien URL;localisation-id;Cote;Résumé;Statut;
175;14;8;Guide de la qualité environnementale dans l'architecture et l'urbanisme;146;4;2ème édition;01/03/10;162 p.;Non;111;5;Non;Physique;Non;Non;1;CTR 00003;Guide méthodologique de prescriptions architecturales et urbaines pour la qualité environnementale de la construction dans la Ville de Grenoble : Aménagements - Bâtiments neufs - Constructions à réhabiliter et Diagnostic des enjeux environnementaux. Véritable manuel de travail à disposition des acteurs de l'aménagement et de la construction : maîtres d'ouvrages publics - aménageurs - promoteurs - constructeurs - services de l'urbanisme et de l'aménagement - architectes - bureau d'étude - entreprises... Ce guide cherche à susciter l'envie de concevoir - de réaliser et de gérer des aménagements ou des bâtiments qui possèderont toutes les qualités habituelles en matière urbaine - de paysage - d'architecture - d'usage et de performance technique - plus celle de minimiser durablement les impacts sur l'environnement des aménagements ou des bâtiments en particulier en économisant l'énergie et en développant les énergies renouvelables - le solaire notamment.;Non disponible;
225;18;12;Marché foncier et activité de la SAFER : Pyrénées-Atlantiques 2012;366;37;Non;01/05/13;6 p.;Non;111;5;Non;Physique;Non;Non;1;FON 00005;Le marché foncier dans les Pyrénées-Atlantiques : les tendances et chiffres clés 2012;Disponible;
224;22;12;Le prix des terres - Analyse des marchés fonciers ruraux 2012;366;37;édition mai 2013;01/05/13;144 p.;Non;111;5;2260-5177;Physique;Non;Non;1;FON 00004;L'édition 2013 présente l'harmonisation complète des publications nationales concernant le prix des terres et près agricoles et celui des vignes - en métropole comme dans les DOM. La tendance générale est à la contraction du nombre de ventes et à la baisse des prix.;Non disponible;
228;14;18;Les usages de la mobilité. Pour une ingénierie des modes de vie;1;188;Non;01/02/13;168 p.;Non;111;5;978-2919507139;Physique;Non;Non;1;HUM 00008;En liant les méthodes analytiques de la sociologie - de la géographie humaine et de la science politique à une ambition générale d ingénierie du territoire - les travaux menés par 6t - sur dix ans d'études et de recherches appliquées - jettent les bases d une ingénierie des modes de vie. Une ingénierie de l'offre de transport qui ne serait pas une réponse à des aspirations est vouée à l'échec. Dans l'univers de choix où évoluent nombre de personnes - il n'est plus guère possible de contraindre les comportements par l'offre. C est d'autant plus le cas que les usagers sont très créatifs pour « détourner » les possibilités de déplacement qui leur sont offertes... au profit de leurs projets. C'est pour toutes ces raisons qu'est proposé de partir des personnes - de leurs logiques et de leurs contraintes - pour imaginer les systèmes de mobilité de demain. Ce livre est le résultat d'un processus collectif de réflexion et d'écriture. Il a fait l'objet de séminaires réguliers au sein de l'équipe de 6t puis d'une rédaction commune.;Non disponible;
211;16;10;"Évaluation de la politique ""Assainissement"" de l'Agence de l'eau Adour-Garonne";26;312;2 exemplaires;01/10/12;23 p.;Non;30;5;Non;Physique & en ligne;Non;http://www.eau-adour-garonne.fr/_attachments/evaluation-des-politiques-de-l-agence-article/%25C3%25A9valuation%2520assainissement.pdf?download=true;3;ENV 00021;Le premier chapitre de ce document présente le contexte et les enjeux de l’évaluation de la politique d’assainissement du 9ème programme d’intervention de l’agence de l’eau Adour-Garonne. Il se poursuit avec la synthèse de l’évaluation - qui présente l’ensemble des réflexions et analyses élaborées à partir des outils mobilisés au cours de cette étude : bilan financier des réalisations de l’Agence en matière d’assainissement - entretiens auprès d’un échantillon d’agents - d’experts - de partenaires et de bénéficiaires - benchmark réalisé dans chacune des autres agences de l’eau - études de cas sur le bassin. Ces analyses ont conduit à proposer des pistes de réflexions pour nourrir les travaux de préparation du 10ème programme. Ces pistes ont été approfondies au cours de deux ateliers de réflexion prospective menés avec des partenaires et acteurs de terrain. Sur la base de ces réflexions - le comité de pilotage de l’évaluation a élaboré des recommandations - qui sont présentées dans le dernier chapitre de ce document.;Disponible;
227;14;10;Recensement des outils fonciers : protection de la ressource en eau;26;312;2 livrets - 20 fiches - 2 posters;01/03/13;32 p.;Non;111;5;Non;Physique;Non;Non;1;ENV 00023;"La Directive Cadre dur l'Eau (DCE) donne pour objectif ""d'atteindre le bon état écologique des masses d'eau à l'horizon 2015"". Sur des territoires à enjeux ""eau potable"" - l'objectif est la recherche d'outils efficaces pour contrôler l'utilisation des sols dont ni la collectivité - ni un établissement public n'est propriétaire - tout en trouvant le juste équilibre entre lutte contre la pollution diffuse et maintien d'une activité agricole économiquement viable. Le recensement des outils ne s'est pas limité à la protection de la ressource en eau potable  - les problématiques suivantes ont été prises en compte : la protection de la ressource en eau potable - la restauration et l'entretien de milieux aquatiques - la préservation et la restauration d'espaces de mobilité de cours d'eau - la préservation et restauration de champs d'expansion de crues - la préservation et restauration de zones humides.";Disponible;
226;12;9;Etude prospective tourisme;198;158;Non;14/03/13;116 p.;Non;111;5;Non;Physique & en ligne;Non;http://www.littoral-aquitain.fr/spip.php?action=acceder_document&arg=979&cle=c2613c5e3cf9c63c5e76d4a218146dad001b9cea&file=pdf%2FProspective_Tourisme_littoral_aquitain_v2-4_VF.pdf;1;ECO 00016;L’étude prospective tourisme s’est déroulée en trois phases de mars 2011 à avril 2012 : - Réalisation d’un bilan des actions entreprises dans le domaine du tourisme depuis la fin de la MIACA sur le territoire du Littoral Aquitain  - - Elaboration des tendances à l’horizon 2020/2040 sur l’évolution de l’offre et de la demande touristique sur le territoire du Littoral Aquitain  - - Proposition d’orientations et exemples d’actions d’amorçage.  Les préconisations faites dans le cadre de cette étude sont destinées à faciliter la prise de décision des adhérents du GIP - qu’il s’agisse des collectivités ou de l’Etat - sur l’ensemble des questions liées à l’aménagement et au développement touristique du territoire. Ces préconisations respectent les grands principes suivants : - Un tourisme - qui respecte l’environnement  - - Un tourisme - source de richesse économique et de création d’emplois  - - Un tourisme - qui réponde à la vocation d’accueil et de mixité sociale du littoral aquitain - en prenant en compte - à côté d’une lecture renouvelée des problématiques déjà repérées les nouveaux enjeux dégagés par l’évolution actuelle de la société  - - Un tourisme - à l’écoute de la population locale.;Disponible;
223;22;20;Pour une mobilité fluide - raisonnée et régulée;2;338;3 exemplaires;01/04/13;186 p.;Non;111;5;Non;Physique & en ligne;Non;http://www.aurba.org/content/download/20782/258666/version/1/file/rapport%20grenelle.pdf;3;TRA 00026;Le rapport commence par une note synthétique qui regroupe diagnostics - principes et mesures d’intervention en 20 propositions. La première partie précise les éléments de diagnostic partagés mais également les divergences et les compromis construits. La deuxième partie évoque les grands principes régulateurs proposés - les valeurs et les orientations du changement de modèle de mobilité - les objectifs et les leviers d'action. La troisième partie décrit le programme d'actions prioritaires à même d'enclencher le changement. Les annexes présentent les documents qui permettent de retracer l’ensemble de la démarche du Grenelle des mobilités.;Disponible (1/3);
221;21;3;Les cités-jardins - un idéal à poursuivre;207;152;N°165;01/04/13;112 p.;Non;88;5;0153-6184;Physique;Non;Non;1;AMU 00062;L'IAU îdF analyse les cités-jardins avec un regard neuf ! Au-delà de leurs valeurs patrimoniales reconnues - elles constituent des ensembles urbains dont les qualités peuvent être réinterprétées à la lumière des questions actuelles sur la métropole. Sans pour autant les calquer - la question aujourd'hui est de penser la ville de demain - durable - dense - sociale et économe. Une relecture des grandes valeurs des cités-jardins apporte des réponses. ;Disponible;
219;22;9;Rapport d'activité 2012;80;258;Non;01/03/13;40 p.;Non;111;5;Non;Physique;Non;Non;1;ECO 00015;Le rapport d'activités fait le bilan des activités de la Chambre de Commerce : Services aux entreprises - filières - formation - ports et équipements - cci en bref;Disponible;
220;22;12;EPFL Béarn Pyrénées - Rapport d'activité 2012;160;175;Non;01/03/13;14 p.;Non;111;5;Non;Physique;Non;Non;1;FON 00003;Deuxième rapport d'activités qui montre que l'EPFL Béarn Pyrénées est en phase de croissance et en bonnne voie pour atteindre les objectifs de dépenses de portage fixés pour le Programmme Pluriannuel d'Investissement 2011-2015.;Disponible;
222;18;2;laissez-vous conter le vignoble du Jurançon;403;2;Non;01/03/13;24 p.;Non;111;5;Non;Physique;Non;Non;3;AMR 00003;Plaquette de valorisation du vignoble du Jurançon : histoire - paysage - patrimoine immatériel.;Disponible;
215;1;3;Rennes - la ville archipel;243;132;Non;01/03/13;176 p.;Non;13;5;9782815907545;Physique;Non;Non;1;AMU 00061;Rennes capitale de Bretagne - Rennes métropole. Jean-Yves Chapuis connaît bien la situation - puisqu'il a participé à la construction de la politique urbaine de Rennes - hier en tant qu'adjoint à l'urbanisme avec le projet urbain - et aujourd'hui comme vice-président chargé des formes urbaines pour ce qu'on appelle « la ville archipel ».  Il nous éclaire sur le sens de ce projet comme mode d'usage des territoires - comme voisinage des différences - comme art de vivre. Ville ancienne - agriculture - nature - constructions - mobilité... Il nous raconte la ville archipel. Non comme refus de la ville - mais comme essai pour la réinventer - pour acter que la ville n'est pas figée. Jean-Yves Chapuis nous invite à construire un récit politique de la cité pour donner une vision urbaine à nos concitoyens - incluant les questions de l'agriculture - du développement durable - de l'énergie - des nouvelles formes urbaines - de l'économie - de l'éducation...  Un entretien passionnant pour qui s'interroge sur la ville - et la vie - de demain. ;Disponible;
217;14;15;Aménager la voirie : 10 principes essentiels pour la sécurité;85;254;Non;05/09/12;51 p.;Non;51;5;  978-2-11-129496-7;Physique;Non;Non;1;INF 00001;Comment traiter un carrefour particulièrement dangereux ? La rue invite-t-elle l’automobiliste à un comportement adapté ? Est-elle sûre pour les cyclistes et les piétons ? Le présent ouvrage s’adresse aux élus et aménageurs qui sont régulièrement confrontés à ces questions et présente sous une forme synthétique les connaissances essentielles qu’il convient de maîtriser pour offrir à chaque catégorie d’usagers les conditions d’un déplacement sûr. Il fait le point sur les grands enjeux en matière de déplacements et de sécurité en agglomération - et montre comment - en respectant quelques grands principes - l’aménagement des espaces publics peut contribuer à réduire le nombre et la gravité des accidents de la circulation en agglomération. Le présent ouvrage invite les décideurs et leurs équipes à reconsidérer la configuration et l’exploitation du réseau viaire dont ils ont la charge - au regard des questions de sécurité des déplacements. Il a également pour ambition de leur fournir les éléments clés - utiles dans le cadre de projets de requalification d’espaces publics. Une confrontation des situations d’accidents les plus courantes en milieu urbain - avec les connaissances éprouvées en matière de sécurité routière - ont conduit à retenir dix recommandations fondamentales permettant d’améliorer efficacement la sécurité des déplacements en milieu urbain.;Non disponible;
124;11;20;Les transports - la planète et le citoyen : en finir avec la galère - découvrir la mobilité durable;277;39;Non;18/02/10;? p.;Non;103;5;978-2917770122;Physique;Non;Non;1;TRA 00017;La question des transports fait toujours l’objet de vifs débats et de prises de position tranchées parmi les politiques. Le citoyen n’est pas en reste : sur ce sujet - qui n’a pas une anecdote édifiante à raconter ? Ce livre brosse - non sans humour - un tableau complet de la situation actuelle : alors que mobilité rime avec modernité - pourquoi est-ce si souvent « la galère » de se déplacer - entre embouteillages - saturation des transports en commun et coûts prohibitifs ? Sur quelles fausses bonnes idées s’est construite la politique des transports depuis soixante ans ? Et si le progrès passait par l’optimisation des moyens existants plutôt que par une course folle au kilomètre de voirie supplémentaire ? En replaçant les comportements du voyageur au centre de leur réflexion - les auteurs - experts du sujet - proposent un panorama de toutes les solutions possibles.;Non disponible;
213;21;3;Europan 11 France valorise le processus;393;142;Supplément au numéro 55 de Traits urbains;04/07/12;24 p.;Non;111;5;1776-9604;Physique;Non;Non;1;AMU 00060;En France - six sites ont été proposés à la réflexion d'architectes - urbanistes - paysagistes - environnementalistes - ingénieurs - sociologues dans le cadre de la 11e édition du concours d'idées Europan. Dix-huit projets ont été sélectionnés dont douze primés. Après une présentation des sites - certains membres du jury français portent un regard sur les postures adoptées par les équipes et sur leurs réponses en matière d'intégration des usages et d'inscription des projets dans une logique de transformation urbaine. Pour mesurer l'impact d'Europan côté opérationnel - des représentants des villes sont interrogés sur leurs attentes et sur leur manière de recevoir les innovations proposées. Des membres de la commission d'expertise d'Europan 11 livrent leur analyse de ces démarches en s'exprimant sur l'intégration de l'évolutivité dans le projet urbain et sur la construction d'un urbanisme du quotidien.;Disponible;
212;21;10;L'avenir de l'eau et des milieux aquatiques les questions importantes et le programme de travail du bassin adour-garonne;26;312;Non;17/10/12;32 p.;Non;111;5;Non;Physique & en ligne;Non;http://www.consultation-2012.eau-adour-garonne.fr/_resources/documentation/BrochureQIHD.pdf?download=true;1;ENV 00022;Ce document présente : • les questions importantes à résoudre pour atteindre les objectifs fixés pour le bassin pour la période 2016/2021  - • le calendrier de réalisation ainsi que le programme de travail précisant les modalités d’élaboration du SDAGE/PDM 2016-2021. Validé par le comité de bassin Adour-Garonne du 24 septembre 2012 - il est soumis à la consultation des partenaires institutionnels et du public pendant 6 mois à partir du 1er novembre 2012.;Disponible;
210;14;18;Les richesses du Seignanx;322;76;Non;01/01/98;24 p.;Non;111;5;Non;Physique;Non;Non;1;HUM 00006;Ce document présente l'histoire du Pays de Seignanx - territoire du sud landes situé aux portes de l'agglomération Côte Basque Adour. Les richesses naturelles - les paysages et l'architecture y sont également présentées ainsi que l'activité économique.;Disponible;
214;22;16;Les filières productives liées à l’énergie en Aquitaine face à la transition énergétique;90;250;Non;01/12/12;122 p.;Non;111;5;Non;Physique & en ligne;Non;http://ceser-aquitaine.fr/informations/avisrapports/rapports/2012/rapport-Energie/Rapport-energie.pdf;1;RES 00001;L’ambition du rapport est de traiter des filières énergétiques - présentes ou en émergence en Aquitaine - comme une composante intrinsèque de l’économie productive régionale. Son approche ne se limite pas à la production d’énergie mais intègre aussi - en amont - les fabrications des industries dérivées et les activités de service – la R&D en premier lieu – qui leur sont liées. Les conclusions et propositions abordent deux niveaux d'analyse : > Celui des réflexions stratégiques pour un développement - en région - des filières énergétiques  -        - Héritages et nouvelles ressources énergétiques en Aquitaine        - Inventaire et cartographie de ressources régionales        - Horizons temporels de la transition énergétique        - Niveaux de gouvernance        - Energie locale durable > Celui des orientations concernant les trois grands groupes d’activités distingués dans le rapport : hydrocarbures - électricité conventionnelle - autres énergies renouvelables.        - Hydrocarbures        - Electricité conventionnelle        - les autres énregies renouvelables;Disponible;
209;21;1;L'appel du large. De la ville aux grands territoires;360;56;Hors série;01/01/09;70 p.;Non;111;5;1240-0874;Physique;Non;Non;3;AMT 00035;"""La XXIXe rencontre nationale des agences d'urbanisme - organisée du 22 au 24 octobre 2008 au Havre - s'est saisie d'une nouvelle échelle territoriale - les « grands territoires » - pour mieux en comprendre les singularités et la diversité. Quels en sont les contours ? Sont-ils une conséquence ou une réponse à l'ouverture internationale et à la mondialisation ? Constituent-ils les nouveaux ""moteurs"" de la compétitivité et du développement économique ? De quels sentiments d'identité sont-ils porteurs et quelles solidarités nouvelles font-ils naître ? Quelles formes spécifiques de gouvernance et de coopération conduisent-ils à inventer ? S'agit-il de creusets de création artistique et culturelle ?""";Disponible;
208;18;10;L'eau - au cœur d'un urbanisme durable;26;325;Non;16/02/12;12 p.;Non;111;5;Non;Physique & en ligne;Non;http://www.eau-adour-garonne.fr/_resources/commun/Exposition/livret_expo_eau_urbanisme.pdf?download=true;3;ENV 00020;Après le Grenelle de l’environnement - tout projet d’urbanisme doit désormais répondre aux critères du développement durable. Il s’agit bien de concilier l’efficacité économique - la cohésion sociale et la protection de l’environnement. Pour éviter des impacts souvent irréversibles sur l’eau et les milieux aquatiques - la collectivité devra donc mieux intégrer tous les enjeux des politiques publiques de l’eau dans ses projets d’urbanisme. Cet impératif est d’autant plus fort sur le bassin Adour-Garonne que celui-ci va connaître d’ici 2030 une hausse importante de population - celle-ci se concentrant surtout sur les agglomérations toulousaine et bordelaise mais aussi sur le littoral basque - jusqu’à Dax.  Confrontées au développement de l’urbanisation - les collectivités seront amenées à maîtriser : • un étalement urbain croissant  - • la transformation d’espaces naturels et agricoles en surfaces artificialisées  - • la fragmentation - voire la destruction - d’espaces naturels.  Cette exposition présente les principaux enjeux de l'eau à prendre en compte dans les politiques d'urbanisme et de développement des territoires.;Disponible;
205;15;1;Nantes Métropole : 50 000 personnes supplémentaires entre 8 heures et midi;407;139;Non;01/03/13;6 p.;Non;55;5;1633-6283;Physique & en ligne;Non;http://www.insee.fr/fr/insee_regions/pays-de-la-loire/themes/etudes/etudes115/etudes115.pdf;1;AMT 00034;À l'image des grandes agglomérations françaises - l'organisation du territoire autour de la métropole nantaise transforme la ville aux différentes heures de la journée : en semaine - ce sont 630 000 personnes qui sont présentes pendant les heures d'activité à Nantes Métropole - soit un gain net de population de 50 000 personnes par rapport à la population résidente. La localisation de la population à différentes heures dans l'hypercentre et dans les grands pôles d'activité traduit la multipolarité de la communauté urbaine de Nantes.  Elle soulève d'importants enjeux en termes d'aménagement du territoire - qui dépassent les limites de la métropole. La concentration en journée de la population dans certains lieux interpelle - au-delà des politiques de déplacements - sur la nécessité de mener des actions concertées d'aménagement urbain - en particulier pour maintenir une bonne accessibilité aux lieux de travail.;Disponible;
206;3;3;La reconquête des espaces publics en centre-ville. Références documentaires récentes;66;271;Non;19/03/13;13 p.;Non;111;5;Non;En ligne;Z:\0_BIBLIOTHEQUE\Documenthèque\BD_Docs&Ressources\Aménagement_Urbain\AMU00058_AURBSE_ReconqueteEspacesPublicsCentreVille_20130319.pdf;http://fichiers.aurbse.org/bibliographie/AUR1235_kkz2j8.pdf;5;AMU 00058;Ce document propose une liste non-exhaustive de références documentaires relatives à des démarches récentes de requalification des espaces publics de centre-ville dans de grandes agglomérations françaises : piétonnisation - harmonisation des matériaux - amélioration du cadre de vie et des circulations douces etc. Il présente également quelques ouvrages généraux sur l’aménagement de l’espace public. Les articles de presse - les dossiers de revues spécialisées - les ouvrages et les documents multimédias (vidéos - sites Internet) cités sont disponibles sur le portail documentaire du centre de ressources de l’agence d’urbanisme. Les notices bibliographiques sont classées par ordre chronologique inverse. ;Disponible;
207;23;3;"Les fiches ""Projet Urbain"" des agences";174;167;Non;22/04/13;98 p.;Non;111;5;Non;En ligne;Z:\0_BIBLIOTHEQUE\Documenthèque\BD_Docs&Ressources\Aménagement_Urbain\AMU00059_FNAU_FichesProjetUrbain_20130422.pdf;http://www.fnau.org/file/news/Projet%20urbain%20complet%20bdef.pdf;5;AMU 00059;"Cette publication présente l'implication des agences d'urbanisme dans les projets urbains. Les démarches varient selon les contextes et rendent compte de la capacité des agences à articuler les échelles - à mobiliser des acteurs multiples et à mener des approches transversales. (Publication liée à ""Les agences et le projet urbain"" - cote AMU 00036)";Disponible;
204;21;3;Les Avis de la FNAU N°4 | Projet de loi Urbanisme et Logement;174;167;Non;01/03/13;2 p.;Non;87;5;Non;Physique & en ligne;Z:\0_BIBLIOTHEQUE\Documenthèque\BD_Docs&Ressources\Aménagement_Urbain\AMU00057_FNAU_ProjetLoi_UrbanismeLogement_20130301.pdf;http://www.fnau.org/file/news/Encart%20pour%20Traits%20urbains%2060%20ok3.pdf;3;AMU 00057;La Fédération Nationale des Agences d'Urbanisme (FNAU) a contribué activement à la concertation lancée par Cécile Duflot sur le projet de loi Urbanisme Habitat - en mobilisant un groupe de travail de directeurs - d'experts et des élus du Bureau de la FNAU. Le bureau du 21 février a validé leur contribution.;Disponible;
203;2;18;Atlas des Franciliens - édition 2013;206;153;Non;01/01/13;232 p.;Non;111;5;978-2-7371-1854-8;Physique;Non;http://www.iau-idf.fr/detail/etude/atlas-des-franciliens.html;1;HUM 00005;50 articles - 200 cartes - 150 graphiques - 232 pages... Cette énumération illustre la grande richesse de l'édition 2013 de l'Atlas des Franciliens. Cet ouvrage fait la somme des connaissances sur les habitants de l'île-de-France d'aujourd'hui - tant sur les aspects sociétaux qu'économiques. L'ensemble des articles sont répartis en quatre chapitres : Population et mobilité - Logement - Structures sociales et modes de vie - Activité et emploi. ;Disponible;
202;16;13;"Synthèse du 10e Séminaire de l'Observation Urbaine : ""Observer pour agir - des outils pour le logement""";85;254;Non;11/04/13;18 p.;Non;111;5;Non;En ligne;Z:\0_BIBLIOTHEQUE\Documenthèque\BD_Docs&Ressources\Habitat_Logement\HAB00014_ObservationUrbaine_20130412.pdf;http://www.fnau.org/file/news/%20sou-2012-synthese.pdf;5;HAB 00014;Consacré à la thématique du logement - le 10e Séminaire de l'Observation Urbaine s'est tenu le 13 novembre 2012 à Paris. Ce document de synthèse présente les résumés des interventions et des échanges de cette journée organisée par la FNAU - le Certu - l'Insee et l'AdCF. Au sommaire : fichier DVF - éventail des bases de données logement - outil de suivi du logement social - observation des loyers privés - focus sur certains segments de logements (habitat dégradé - maison individuelle).;Disponible;
