N°;type-id;thematic-id;Titre;author-id;editor-id;Mentions d'édition;Date de publication;Pagination;Tomaison;collection-id;language-id;ISSN - ISBN;Support;Adresse Document Source;Lien URL;localisation-id;Cote;Résumé;Statut;
429;13;3;KaléidoSCoT : expériences d'agences d'urbanisme;174;254;Non;01/10/08;208 p.;Non;111;5;1240-0874;Physique & en ligne;Non;http://www.fnau.org/file/news/kaleidoScot(5).pdf;1;AMU 00120;Huit ans après la promulgation de la loi Solidarité et renouvellement urbains (modifiée par la loi Urbanisme et habitat) - la majorité des SCoT des grandes agglomérations ont été réalisés par des agences d’urbanisme. Le réseau des agences a acquis durant ces années une réelle expérience en matière d’élaboration et de gestion des SCoT. De nombreux SCoT de cette première génération connaissent depuis quelques années une phase de finalisation ou de mise en œuvre : certains - approuvés - voient déjà l’application de leurs orientations  - d’autres - en cours d’achèvement - connaissent un niveau relativement avancé d’élaboration et de définition du projet.;Disponible;
428;21;10;Climat - air - énergie: les territoires en transition;5;334;Non;01/05/15;27 p.;Non;76;5;1240-0874;Physique & en ligne;Non;http://www.adcf.org/files/MAG-INTERCO/ADCF-Interco200-web-V2.pdf;1;ENV 00060;Le projet de loi de transition énergétique pour la croissance verte - en cours d’examen au Parlement - porte parmi ses objectifs un renforcement des compétences des collectivités en matière de politiques énergétiques et du climat. Un pas important - qui devra être suivi au coeur des territoires par la mise en oeuvre de véritables stratégies.;Disponible;
426;21;14;Maîtriser l'imperméabilisation des sols;2;338;Non;01/05/15;8 p.;Non;111;5;Non;En ligne;Non;http://www.aurba.org/Publications/Syntheses/Environnement/Maitriser-l-impermeabilisation-des-sols;2;IDC 00022;L’imperméabilisation des sols et ses incidences sur le cycle de l’eau (risques accrus d’inondation ainsi que de pollution des nappes phréatiques et cours d’eau - augmentation des coûts d’assainissement…) figurent en bonne place dans la liste des effets négatifs sur l’environnement de l’étalement urbain observé en France et en Europe depuis les années 1970. Si la limitation de la consommation d’espaces naturels - agricoles et forestiers en frange et à l’écart des agglomérations demeure l’un des principaux enjeux d’un développement urbain durable - la maîtrise voire la réduction de l’imperméabilisation des sols dans les espaces déjà urbanisés au sein des agglomérations devient elle aussi un objectif crucial pour réduire la vulnérabilité des milieux urbains aux effets des changements climatiques en cours et à venir (en particulier effet îlot de chaleur urbain et risque inondation accru). Cet enjeu est à concilier et à articuler avec deux autres ambitions importantes en matière d’urbanisme : - le renforcement de la présence de nature en ville  - - la nécessité de « reconstruire la ville sur elle-même » - en optimisant le foncier libre dans les espaces déjà urbanisés. Comment appréhender et mesurer l’imperméabilisation des sols en milieux urbain et périurbain ? Quels sont les outils mobilisables pour maîtriser ce phénomène ?;Disponible;
11;6;1;Le Plan de Développement Durable du Littoral Aquitain 2007 - 2020;198;158;Non;25/06/10;76 p.;Non;111;5;Non;Physique & en ligne;Non;;3;AMT 00003;Fruit d’une réflexion collective et partenariale impliquant l’ensemble des acteurs du littoral - ce document a nécessité plus de 18 mois d’élaboration - au cours de laquelle se sont mobilisées les instances de gouvernance et de concertation du GIP. Il a été validé par l’Assemblée Générale du GIP d’octobre 2009 puis approuvé par l’ensemble des collectivités membres à la fin de l’année 2009. Elément central d’une stratégie d’aménagement partagée du territoire à l’horizon 2020 - le PDDLA s’appuie sur les 3 piliers du développement durable et sur les principes de la gestion intégrée des zones côtières. ;Disponible;
425;21;1; Saisons en ville - LA Confidential - Crowdfunding et urbanisme - Bio-diversité;2;110;Non;07/05/15;84 p.;Non;20;5;978-2-36062-128-6;Physique & en ligne;Non;http://www.aurba.org/Publications/CaMBo/CaMBo-7/Editorial-de-CaMBo-7;1;AMT 00060;Des liens ! Des lieux certes - mais aussi des liens. Villes et territoires doivent aujourd’hui se comprendre et se concevoir dans cette dualité. Or - cette manière de voir ne va pas de soi. Car tout concourt à privilégier des représentations de l’espace faites de périmètres et de surfaces. Logiques politiques et techniques convergent pour préférer les limites et les aires aux flux et aux réseaux. La géométrie euclidienne l’emporte sur la théorie des graphes.  Le politique s’organise à l’aune des circonscriptions électorales - fort légitimement du reste. La planification spatiale - structurée par l’occupation foncière - adopte les langages de l’architecte et du géomètre-expert : des zones et des parcelles - des hectares et des mètres carrés. Les statisticiens découpent les territoires en mailles - tels les Iris (« îlots regroupés pour l’information statistique ») chers à l’Insee - survalorisant de facto l’information géographique« surfacique ». Les aplats de couleur organisent les cartes.  Inventée il y a plus d’un demi-siècle - l’approche systémique nous a pourtant habitués à voir le monde avec des points et des flèches - pour privilégier les échanges entre les parties du système étudié plutôt que l’analyse de chacune d’elles (oublier Descartes et son obnubilation du découpage !). D’ailleurs - dans sa vie d’habitant - de travailleur - de client - d’usager - chacun sait bien que les limites administratives se franchissent quotidiennement - sans coup férir. Et chacun sent confusément que si les hommes ont inventé la ville - ce n’est pas pour rester au logis mais pour « maximiser les interactions spatiales » - autrement dit favoriser le développement des liens entre les individus - les activités - les lieux.  Les dynamiques territoriales contemporaines accentuent cette dimension relationnelle de l’urbain. Sous la double impulsion de l’intensification des échanges économiques et des progrès techniques - la mobilité et les échanges s’accroissent. La « métropolisation » résume ce processus de « mise en réseau » - au-delà des terminologies institutionnelles du moment.  Il revient aux analystes de proposer les informations – les chiffres - les cartes et les notions – aptes à rendre compte de cette nouvelle géographie des flux et des interdépendances  - aux acteurs politiques d’imaginer et mettre en oeuvre les dispositifs de gouvernance en phase avec l’« interterritorialité ».  Il ne s’agit certes pas de livrer les territoires à la « tyrannie » des flux - ceux de l’économie ou des grands réseaux de service. Mais il faut inventer des combinaisons inédites entre lieux et liens - sachant accepter des appartenances territoriales et réticulaires multiples. C’est à quoi nous invite Olivier Mongin dans son bel ouvrage sur La ville des flux. L’envers et l’endroit de la mondialisation : encourager « l’émergence de milieux qui cherchent à soumettre ces flux à l’exigence anthropologique de l’habiter - ainsi qu’à celle - politique - de l’agir ensemble ».  Il convient aussi de penser à ses « voisins » - à ne pas négliger ce qui est de l’autre côté du trait (les voisins proches de la contiguïté) ou au bout de la ligne (les voisins lointains de la connexité). Ne pas faire comme les présentateurs de la météo qui - chaque soir - commentent une carte de France entourée d’un no man’s land sans soleil ni nuages. Oublier la tentation insulaire.;Disponible;
420;21;3;VILLE ET PORT Comment le maritime se dessine dans la ville;58;280;Non;01/03/15;4 p.;Non;123;5;1964-5155;Physique;Non;Non;1;AMU 00117;Les places portuaires peuvent être définies comme l'interface entre les espaces maritimes et continentaux - dépassant largement l'arrière-pays des villes - ouvert sur le monde d'un côté - parfois sur un continent de l'autre. Mais à l'intérieur même de cette interface - il en est une autre - mouvante au cours des temps - qui est celle de la limite entre le port et la ville. Sous un double phénomène d'évolution de l'organisation portuaire et de pression urbaine des villes - certains espaces changent de vocation. Quels sont les processus à l'oeuvre?;Disponible;
423;21;3;Commerce & mode de vi(ll)e;58;280;Non;01/12/14;19 p.;Non;4;5;2260-3840;Physique & en ligne;Non;http://www.aucame.fr/web/publications/acturba/fichiers/ActUrba13_commerce.pdf;1;AMU 00118;Si l’agriculture a inventé les sociétés agraires - le commerce a inventé les sociétés urbaines. Grand marqueur de civilisation - le commerce suppose la rencontre de vendeurs de biens et d’acheteurs en un même lieu. Ce lieu ne tarde pas à s’aménager afin de concentrer les services - les équipements et les circulations qui permettent de négocier - de financer - de stocker - de transformer - d’informer… toutes activités issues de l’échange marchand. On peut distinguer trois grandes phases dans le lien entre la ville et le commerce dans l’histoire humaine : _ D’abord - le commerce fut générateur de l’urbain. Les villes se sont dimensionnées autour de la renommée de leurs foires - d’ampleur parfois internationale (comme en Flandres ou dans la vallée du Rhône) ou de rayonnement régional - permettant la convergence des produits des terroirs pour des marchés assurant la jonction entre la campagne - lieu de production - et la ville - lieu de négoce. La plupart de nos villes sont encore dessinées autour de leurs halles - de leur place du marché - avec une densité forte du bâti de centre urbain. _ Dans un deuxième temps - à partir du XIXe siècle - le commerce a accompagné l’urbain. En effet - pour capter les clientèles et les flux - les commerces se sont sédentarisés - installés sur une ou plusieurs grandes rues - avec des boutiques en pied d’immeuble et des logements dans les étages. Les foires et marchés ont laissé la place à un commerce permanent - structurant les premières opérations urbanistiques avec des passages commerciaux - des grands magasins. Les modes de vie se sont mis à évoluer plus vite que la ville. _ Le troisième mouvement marque une véritable révolution au sens premier du terme : le commerce jusqu’alors générateur de centralité urbaine s’est brusquement tourné vers la périphérie avec le phénomène de la grande distribution. Entre 1960 et 1990 - le commerce a profondément modifié le paysage urbain et les entrées de ville avec les vastes zones commerciales - créant non seulement une nouvelle interface entre urbanité et ruralité - mais aussi un tissu urbain distendu - avec de vastes espaces consommés - un bâti pauvre et théoriquement recyclable - tandis que les centres urbains se vidaient des commerces de proximité. Entrons-nous dans une quatrième phase ? À l’occasion d’une réflexion de Caen-Métropole sur le sujet - cet Act’Urba se propose de faire le point sur les enjeux du commerce et de la ville dans une vision prospective. ;Disponible;
421;12;10;Elaboration du Schéma Régional de Cohérence Ecologique Aquitaine (SRCE) - Volet a) Diagnostic et enjeux des continuités écologiques en  Aquitaine;355;48;Document de travail;01/06/13;120 p.;Non;111;5;Non;Physique;Non;Non;1;ENV 00056;Le présent document constitue le volet a) du Schéma régional de cohérence écologique (SRCE) d'Aquitaine relatif au diagnostic et aux enjeux liés aux continuités écologiques à l'échelle régionale. Il s'agit à ce stade d'élaboration d'un projet dont certaines rubriques devront être complétées ou adoptées en fonction de l'avancement des autres parties du SRCE. Ces rubriques à compléter ou à adapter sont surlignées en jaune.;Disponible;
424;22;10;La relocalisation des activités et des biens en Aquitaine - Site atelier de Lacanau;198;158;Non;01/05/14;34 p.;Non;111;5;Non;Physique;Non;Non;1;ENV 00057;Le GIP Littoral Aquitain en partenariat avec la commune  de Lacanau a initié une réflexion prospective pour la mise en œuvre d'un projet d'urbanisme - sur le long terme - tenant compte des implication du recul du trait de côte sur la station de Lacanau. Cette démarche vise à produire différents scénarios prospectifs de reconfiguration urbaine à l'horizon 2040/2100 - en lien avec un positionnement touristique.;Disponible;
422;22;10;Synthèse des enjeux de l'organisation de l'espace;198;158;Non;01/02/15;119 p.;Non;111;5;Non;Physique;Non;Non;1;ENV 00058;Le présent rapport s'organise autour des cinq grands chapitres thématisés en lien avec les problématiques spécifiques de l'aménagement du territoire du littoral aquitain - à savoir: les dynamiques démographiques et résidentielles - les espaces naturels agricoles et forestiers - les risques naturels - le développement économique ainsi que les mobilités. Il s'est agi de dessiner un portrait précis du littoral aquitain visant à mettre en avant des évolutions plutôt qu'un état des lieux figé. Chaque chapitre se conclut par une sélection des grands enjeux thématiques faisant écho aux questions que l'on peut se poser quant au devenir du littoral aquitain. Dans le souci de dépasser l'approche thématique - une relecture globale et croisée a permis de dégager les 5 grands enjeux transversaux en matière d'organisation de l'espace du littoral aquitain.;Disponible;
53;14;1;Plans locaux d’urbanisme intercommunaux;85;195;Non;06/02/12;156 p.;Non;29;5;0247-1159;Physique;Non;Non;1;AMT 00011;Le Plan local d’urbanisme intercommunal est à l’ordre du jour. Plusieurs dispositions de la Loi « Grenelle 2 » vont révolutionner les méthodes et les pratiques de la planification urbaine. Parmi celles-ci figure notamment l’encouragement à l’élaboration de Plans Locaux d’Urbanisme (PLU) à l’échelle intercommunale. Jusqu’ici « réservé » aux seules communautés qui en avaient la compétence soit de plein droit - comme les communautés urbaines - soit volontairement - comme certaines communautés d’agglomération ou communautés de communes - le Plan local d’urbanisme intercommunal (PLUI) devient par la loi Grenelle II un principe reconnu et encouragé. La loi précise aussi que les PLUI doivent intégrer - lorsqu’ils existent - les Programmes locaux de l’habitat (PLH) et les Plans de déplacements urbains (PDU) - devenant ainsi les instruments privilégiés de la mise en cohérence des politiques publiques territoriales. La « révolution » du PLU intercommunal ne réside pas dans son élargissement géographique car les PLU de certaines grandes communes couvraient déjà un très vaste territoire. Elle est bien davantage dans son caractère intégrateur (trois documents en un seul) et bien sûr dans son exigence d’intercommunalité.  Cette « révolution » a amené la FNAU - en partenariat avec le CERTU - à mobiliser les moyens d’expertise de son réseau pour recenser - mutualiser et capitaliser les meilleures pratiques en matière de planification urbaine intercommunale. Cet ouvrage en est le fruit. Il analyse - dans leur diversité géographique - culturelle ou territoriale - les expériences des PLUI de l’avant Grenelle et il propose un guide et des références pour la construction des PLUI de demain. Pédagogique et militant - il ouvre la voie à la généralisation de ces nouveaux documents d’urbanisme intégrateurs.;Disponible;
418;22;13;20e Rapport sur l'État du Mal-Logement en France;178;165;Edition 2015;26/01/15;314 p.;Non;111;5;Non;Physique & en ligne;Non;http://www.fondation-abbe-pierre.fr/20e-reml;3;HAB 00026;La Fondation Abbé Pierre publie cette année son 20e rapport sur « L’État du mal-logement en France ». 20 ans après - elle ne s’imaginait pas devoir dresser un aussi dur constat de la situation actuelle. Une occasion de s’interroger sur les blocages structurels - sociaux ou idéologiques - qui produisent aujourd’hui une situation toujours aussi pénible pour plusieurs millions de nos concitoyens - dont plus de 3.5 millions sont mal logés ou même en errance... Ces personnes - dont on parle finalement davantage à coups de statistiques - la Fondation a voulu montrer leur quotidien de forçats de l’abri - se heurtant aux manques criants de réponses à leurs besoins et à des labyrinthes institutionnels froids ou kafkaïens (malgré les nombreuses mesures mises en œuvre ces dernières années - telles la loi Dalo - le « logement d’abord » - le SIAO - etc...) - oubliant que derrière chacun de ces millions de ménages - il y a des enfants - des femmes - des vieillards - des hommes - tordus de souffrance et de peur du lendemain - quand ce n’est pas du soir même. Aujourd’hui - la crise du logement est toujours aussi criante. Et - malgré des intentions politiques qui prêtaient à l’optimisme - certaines des avancées sociales annoncées ont eu bien du mal à se concrétiser quand elles n’ont pas été détricotées en chemin... alors même qu’elles bénéficiaient d’un soutien politique - d’un mandat électoral clair et d’un réel relais dans l’opinion. Pourquoi cette résistance ? Le manque de volonté des acteurs et des financements publics n’est pas seul en cause. En s’appuyant sur les leçons de ces vingt ans d’action et d’inaction et sur son Contrat social pour une nouvelle politique du logement qui reste en jachère malgré la signature présidentielle - la Fondation Abbé Pierre s’interroge et interpelle à nouveau les pouvoirs publics de tous niveaux dans les responsabilités qui sont les leurs. Pour la vingtième fois. Mais elle garde des raisons de croire qu’elle continuera à dépasser les résistances au profit du plus grand nombre.;Disponible;
415;14;3;Le projet urbain en temps de crise : l’exemple de Lisbonne;51;189;Non;19/06/13;160 p.;Non;34;5; 2-281-19557-0 ;Physique;Non;Non;1;AMU 00114;Révolutions - incendies et impasses économiques : les crises battent la mesure des évolutions urbaines à Lisbonne. Son projet urbain fait un pied de nez à la crise financière qui s’enracine en Europe et génère une inventivité à tout crin - de l’action urbaine aux initiatives sociales et culturelles - sources de convivialité et de cohésion. Sobre dans ses réalisations - ce projet urbain entérine une vision « haut de gamme » : valorisation de l’espace public - réduction de la place de la voiture - régénération du centre et création de polarités périphériques - réconciliation avec un fleuve majestueux - le Tage. Le livre invite à découvrir des projets phares de trois secteurs de la métropole : la ville historique - les rives du Tage et un « collier » de nouvelles centralités. Un guide mixant histoire et prospective - pour les arpenteurs de l’urbain !;Disponible;
416;14;3;Aménager la ville par la culture et le tourisme;282;189;Non;19/03/13;160 p.;Non;143;5; 2-281-19555-4;Physique;Non;Non;1;AMU 00115;La fabrication de la ville évoque avant tout la réalisation d’infrastructures (rues - places - parcs - réseaux) et la construction de logements - équipements publics - bureaux - industries - qui font sa matière visible. Tel a été longtemps – et demeure encore largement – le rôle dévolu aux aménageurs. Mais - derrière ces fonctions matérielles - se cachent des dimensions plus immatérielles comme l’image - le rayonnement international - l’attractivité - la fierté des habitants et leur sentiment d’appartenance à la ville ou au contraire de mise à l’écart - toutes réalités qui transforment nos villes et orientent leur avenir plus sûrement que beaucoup de réalisations matérielles. Ces questions ne sont pas nouvelles - mais des phénomènes récents comme la mondialisation ou la réduction du temps de travail leur ont donné une dimension sans précédent dans l’histoire. Comment ces questions interagissent-elles dans la politique des villes aujourd’hui - dans leur stratégie internationale comme dans leur politique vis-à-vis des habitants ? Comment organiser les différents métiers qui « font » la ville avec ceux qui « font » la culture ou le tourisme - pour passer d’une vision fractionnée par métiers à une vision partagée et à une action conjointe ? À partir de nombreux exemples - ce livre tente de répondre à ces questions et d’ouvrir des pistes pour demain.;Non disponible;
414;21;10;CLIMAT - AIR ET ÉNERGIE - ÉDITION 2014;8;331;Edition 2014;01/02/15;172 p.;Non;111;5;Non;En ligne;Z:\0_BIBLIOTHEQUE\Documenthèque\BD_Docs&Ressources\Environnement_Paysage\ENV00055_Ademe_Edition2014_CLIMAT_AIR_ENERGIE_20150201;http://www.ademe.fr/chiffres-cles-climat-air-energie-2014;5;ENV 00055;Afin de partager les chiffres clés « climat - air - énergie » avec l’ensemble des acteurs de la maîtrise de l’énergie - du développement des énergies renouvelables et de la lutte contre la pollution atmosphérique et le changement climatique - l’ADEME a souhaité réunir dans un seul document de référence les données essentielles sur la consommation énergétique - le développement des énergies renouvelables et les émissions de polluants atmosphériques et de gaz à effet de serre. Les secteurs concernés sont le bâtiment - les transports - l’industrie - l’agriculture et la forêt. L’édition 2014 présente l’évolution des chiffres clés depuis 1970 jusqu’à 2013 et inclut une nouvelle rubrique dédiée aux déchets.;Disponible;
413;15;13;Les conditions de production du logement social en Aquitaine;52;289;Non;01/11/14;23 p.;Non;111;5;Non;Physique;Non;Non;3;HAB 00025;Publication de l'Association régionale des organisme sociaux pour l'Habitat en Aquitaine consacré aux coûts et fiancements du logement social en Aquitaine sur la période 2005-2013. Cette publication vise à donner aux acteurs aquitains de l'habitat des points de repère sur les conditions économiques de production dulogement social dans la région.;Disponible;
412;11;10;L'eau dans la ville  I  Une amie qui nous fait la guerre;78;132;Non;01/03/15;320 p.;Non;111;5;Non;Physique;Non;Non;1;ENV 00054;« L’ouvrage croise l’analyse d’un ingénieur et d’une géographe dans une relation entre les villes et l’eau qui paraît évidente et qui pourtant ne va pas de soi. Il aborde pour les villes françaises  – une gestion de la ressource et des risques toujours plus réglementaire et technique  – des empilements réglementaires et institutionnels qui ne facilitent pas les choix  – un rapport à l’eau des urbains peu connu - une fois dépassée l’idée d’un retour de l’eau en ville et de la restauration plus naturelle des berges -   – des moyens financiers contraints par la crise mais aussi par les choix de gestion. L’objectif est de poser la part à faire aux logiques en place - de décrypter les signaux à analyser - pour dégager des questions à traiter par l’ensemble des acteurs et permettre au politique d’agir. »;Disponible;
411;21;3;Euroméditerranée à Marseille : Réconcilier la ville et le port;58;280;Non;01/12/14;4 p.;Non;111;5;Non;Physique & en ligne;Non;http://www.aucame.fr/web/publications/quen_savons_nous/fichiers/QSN069_Euromed.pdf;1;AMU 00113;Au début des années 1990 - a été fait le constat du déclin de Marseille : défi cit démographique - déclin économique et défi cit d’image. Face à ce constat et sous l’impulsion de l’État et des collectivités locales - l’opération Euroméditerranée est lancée en 1995. C’est la plus grande opération de rénovation urbaine d’Europe du sud. Au cœur de Marseille - elle s’étend dans un périmètre de 480 hectares qui inclut - au nord du Vieux-Port et du centre de Marseille - une partie du port de commerce et les quartiers compris entre celui-ci et la gare Saint-Charles. Le maître mot de ce projet est l’attractivité qui passe par la mise en valeur d’un extraordinaire patrimoine naturel et bâti. Ce projet s’inscrit dans la durée : la première phase de 310 hectares est aujourd’hui achevée et laisse place à une seconde phase qui devrait s’achever au début des années 2030.;Disponible;
408;1;1;Regards croisés sur l'avenir du massif forestier des landes de Gascogne - Sabres 1/10/2013;147;213;Non;01/02/15;95 p.;Non;111;5;Non;Physique;Non;Non;1;AMT 00059;L'Etat a entrepris - par les entretiens de Marquèze - de réfléchir et proposer des thèmes d'action pour enrichir le processus de développement durable du massif forestier des landes de Gascogne. A la suite de la tenue le 1er octobre 2013 de la journée d'échange ;Disponible;
407;15;3;loi NOTRe Schémas régionaux et ingénierie;174;167;Non;01/02/15;2 p.;Non;111;5;Non;Physique;Non;Non;1;AMU 00112;A l'occasion des discussions autour de la loi NOTRe - la FNAU fait paraître un avis portant spécifiquement sur les chémas régionaux et l'ingénierie. La FNAU propose des schémas régionaux négociés et juridiquement robustes - souples dans les modalités d'association des acteurs et émet des préconisation pour une ingénierie apte à accompagner la nouvelle construction territoriale.;Disponible;
